class, text
0, crossing points km ALT
0, world the French circuses associated
1, brook that falls in cascade
0, one of the control terminals
1, from the collar from right into
1, joins the parking lot quoted more
0, music circus and
1, quickly a small communal road
1, the trail is relatively well
1, take the right path
0, many Anglo Saxon churches
0, the J1 tag is
1, large laces and follows
1, follow this path on 500m
0, a new delicate passage equipped with
0, like a balcony or a
1, left the lane yellow markings
0, a typical Baroque gazebo is
0, of the term Italian origin Belvedere
0, ascent route to return
0, and the odd terminals on
0, standard integrated circuits industry
0, so the holes in the Middle
0, the maximum longitudinal slope is
0, ratio to peak of 2006
1, access the parking lot from the
0, adjacent to the building with
0, keep do not miss the
0, is the bifurcation station of the two
0, skiables to access lookouts
1, reach the parking points of
0, also called the lookouts circuit
1, by road points of
0, the bifurcation would allow
1, or cut ski slopes the pistesdeski
1, exiting the parking lot take the
1, the second path the first
1, the building has three facades
1, and aim for Church to join
0, practice of the Boulevard in urbanism
1, and a bus corridor
0, from his Ark to find out
1, reservoir the track that leaves
1, the slope accentuates the path
0, on the balconies loggias or
1, rehang a NE trail that
1, under high voltage lines
0, many buildings are built
1, right the path that by
1, breaches its walls
1, between the stone houses
0, Tuesday so no parking
0, workers and white collars are
1, from the road in a
1, along the Weir of the Lakes by
1, up to short laces up
1, the same path as the
1, then a trail almost constantly
0, eliminated circuses using
0, turn beacon interest
1, arriving Superdévoluy in the
0, a railroad rack
0, the same path as the
0, name a chalet and a
0, carved wooden door with
1, two Gallo Roman millionaires
1, Combe the path becomes a
1, left side through the rocks
0, surface and a parking book
0, the descent does by
1, has several lookouts offering as much
1, face the path that rises
0, glazed and elevated balconies
0, isolated points such as lookouts
0, forms a modern arch to the
0, making huts either for
0, cascading styles starts as soon as
0, several balconies around a
0, old boulevards was not
1, the real Summit 3163m offers
1, hike is done by the
0, access a gazebo or a
0, served as border pillar the stone
1, and a breach an angle
1, sports a white cross as
1, same path to the crossroads
1, from this Chalet leave the
1, at the end of the road
0, presence of hiking panels
1, drive to road 10
1, arrived an intersection stay on
0, Boulevard title are
1, visible from the parking lot that leaves
0, one or more aesthetic Bifurcations
1, a short descent into a
1, in the slope towards
1, quickly on a path to serve
1, a few Woods to the parking lot
1, on a bridge to stride
0, cabin names and hut
1, elevation difference for intersection of ascent the crossroads
0, where cemeteries abound with
1, passable road to the first
0, progressive but not too pronounced
1, passing through some woods until
1, from the Lake rehang a trail
1, ignore the right path and
1, cross the road to take
0, or without barriers guarded or
1, by laces the last
1, end of the lake where part
0, Boulevard name while
0, and the control circuit
0, cabin mode in the
0, perennial plants and ponds
0, 10-storey bar
1, on this road ignoring
1, continue on the right bank of the
1, form independent watersheds
0, low roof slopes protrudes from
0, with retaining arches
0, signalling of Bifurcations in particular
0, opening of railways
1, by the well-visible path
0, voltage at the terminals of each
0, under or on the building
1, then the trail that leaves
1, supporting the balcony of the first
1, a rich bambouseraie the garden
1, the first pin and take
0, thousands churches including 200
0, on a racetrack the
0, or a natural arch carved
1, and go under the ski lift
1, Park direction then all
1, level one wash follow the
0, will install a bicycle gateway
1, a small parking lot where we
0, is a building built in
0, so as not to upset some
1, right and cross the parking lot
0, crossing points km ALT
1, on the Lake along the
1, North the paved forest road
1, then pass left bank and
0, on the path notice the
1, the mountain slope trail that passes
0, the Chalet is a building
1, South of the ski home
0, from the top of the tag
1, a second beacon that is
1, reach the parking points of
0, passing the 30 bar
1, always in the direction of the Belvedere
1, following the road we will
0, evolutions in cascades in the
1, then to the parking points of
0, a balcony of Italian balcone
1, a small collar between the
0, border border terminal one Terminal
1, take the right path in
1, cross the Col and descend
0, no 64 balcony of the second
1, a slight rise joins the
0, following the bars were formed
0, torrent name is well
1, lined with house built in
1, arrived at the top left there
1, along the road always in
1, a good regular trail and
1, at the first spur continue straight
0, construction of the building containing the
0, are oscillating Bifurcations like
0, in apartments and mini chalets
0, Parisians last rampart before the
1, the small road that starts
0, would not have a cross
0, crossing points km ALT
1, in the path through a
1, pass a straight path to
0, following the bars were formed
1, campgrounds including a
0, corridors a learning basin and
0, emergency call terminals BAU
1, the same path to the
1, reverse to the previous junction
1, take the left trail
0, railroad patent
0, a Boulevard the same role
1, reach the Col between the
0, and traffic gateways
0, origin 22 arches there in
0, boulevards was not over in
0, and the odd terminals on
0, and chalets for rent
1, take the path in front
0, Staffel first railroad
0, and automatic terminals of
1, emblem of the basin and constitute
1, visible just like the collar
1, on the track and pass
0, recording its population peak
0, slope and
0, the bifurcation marked the ascent
0, this hemispherical Colonnade building includes
1, ignore the path in front
0, from the bar of 10
1, right and follow the path
0, such will not result as
1, on a steep slope on
0, Provencal Cabana cottage hut him
1, by an open breach in
0, doubled cross section
0, cascading styles with
1, bottom of the parking lot climb in
1, leaving the path to the right
1, the next fork turn on
1, bottom of the Valley to find
0, start in rib to prevent
1, reach the passing pass with
1, Church direction then take
1, follow the path by pouring
1, the climb to the top
0, a set of urban boulevards with
0, cannot protect them
0, path not all done
1, to arrive at a crossroads in
0, in some churches of the same
1, facing a street that rises
1, the right spur and continue
1, another path oriented to the
1, many laces to go
0, camping pitches available for
0, lacking basins due to lack of
1, above the road
1, follow the passable path until
1, red this path walks in
0, stone hut bottoms
1, an excellent path that is
0, railroad rack
0, wooden panel indicates more
1, ignore the right path
0, crossing points km ALT
0, built in Belvedere at the edge
1, join the crossroads a wide
0, tendinitis goose Paw Paw
0, crossing points km ALT
0, diving waterfall
0, via a complex circuit of
1, take the NW Trail that
0, large number of churches in particular in
1, this castle enlarged by the
1, in a well marked path
1, and back down right bank in
1, slope part
0, types of gaps a breach
1, join a dirt road
1, left the path to go
1, at the first crossroads to take
0, same path as the ascent
1, tree a wooden panel
1, the remarkable buildings and places
1, there the trail expands to
1, find 17 campsites in the
1, sees the road and a
0, when crossing the side
0, will be the way back
0, the tag is then referred to as
1, take the middle way
1, between two yellow marking houses
1, in front of the campsite and join
1, through the slopes and join
0, would block the surrounding intersections by
0, well traced path is heading
0, on its steps to the
0, Quebec Boulevard often includes
1, leave the road to borrow
0, algorithm will favor appearance of Bifurcations
1, reach a crossroads Col-
0, and buildings receiving
0, articular neck narrowing the
1, a small road not far
0, resulting from the cross between
1, at the crossroads a signpost
1, track that goes to the forest
1, a small parking lot left of
0, see a peak occurrences of
1, take the left slope indicated
1, on the path we cross
0, large masonry cabins
0, road between two crosses
0, turn the torsion bar
0, cross shape North oriented
0, sculptures and open balconies
0, type tags and
0, a Boulevard is a way
0, that British basins are
1, to find a new crossroads
1, to the Observatory Observatory buildings
0, parishes and churches offer these
0, are Bifurcations that lead
1, the trail will raise for
0, no negative circuit and
0, between buildings or established
1, from the viewpoint of the
0, the simple manual barrier to the
1, on the main trail and then
0, wooden piece and voerk
0, and mouldings wide window balconies
1, from the parking lot take full
1, a small shelter with a
0, mycontour of the old chapels of
1, a small campsite allowing a
1, share a trail that climbs
1, and continue on the way
0, cascading styles starts as soon as
0, they were not accustomed to
1, first in forest trail in
0, visit chapels other ovens
0, the stunts and gags imagined
1, right of the Lake and follow
0, tensile steel bars reinforcement
0, bifurcation theory consists of classifying
0, with wooden balconies
0, the inner goose paw part of the
0, dead some cemeteries also welcome
0, central peak bass in
1, nine cast iron arches
1, in the path under the
0, bosquets first bar of 10
0, by individual bars or
0, from this bifurcation station for the
0, from then Boulevard all axis
0, in the arches of the buildings
0, June or circus in motion
0, on its steps for a
1, then the path becomes less
0, quickly the 100 bar
1, the trail marked on the
1, in a path that became more
0, the two arches to
1, or two laces and reach
0, there is an absorbent circuit and
0, theory of Bifurcations in mathematics
1, a low slope in the forest
0, width of the paths was often
1, pass a straight path to
0, do not let yourself be
0, or a specially constructed building
1, then the path becomes grassy
1, Park parking of the Town Hall parkingdelamairie +
0, ageing of holding bars
1, and the starting parking
1, reach the biathlon Stadium
0, that balconies collapse hurling
0, the ascent is gradual via
0, sees a Christian cross around
1, arrival buildings of the cable car
0, compared to the peak of dollars
0, wooden poles and Mu
1, last rampart before the Summit
1, on the path that starts
0, that the French circuses motorizing
1, to the Chalet visible shelter
0, organize distribution circuits
0, crossing points km ALT
0, find a passage trying
1, red this path walks in
1, on the left path in
1, by this marked track PR
0, a free spillway the
1, up to a crossroads instead
0, of which seven bars of 10
0, and Wi Fi terminals
0, no more tags or attributes
1, now this very good path
0, and the boulevards are destroyed
1, times at the collar ignore the
,
0, elsewhere a basin and a
1, of these boulevards is traversed
1, easily the way into
1, the big crossroads take left
1, concrete road side it not
1, away from the arrival buildings
1, join the more marked trail
0, often modeled using bars
0, a crossroads discipline Jacqueline Bonnamour
1, take the road towards Gève
0, many high buildings should see
1, take the road towards
1, between wood and meadow scree
0, Wolf the bamboseraie of bamboo
0, install a chalet if its
0, side of public buildings station
0, relations on bar this symbol
1, forest in gradual ascent but
1, borrow the path quite well
0, also stone huts
0, occupied by Church that installs
0, call them cottages seen their
0, kinds of tectonic breccias following
0, road there no traffic
0, increase of the automatic terminals of
0, Champerret is not started in
1, remains of the Canal and takes
0, a large parking regional interest
0, the most beloved chapels
1, reach the gateway on the
0, confers Knight's cross
0, they occupy not old location
1, starts behind transformer post transformer EDF
0, the call terminals are all
1, in the forest and descends
0, or two bars for
0, elevation the Belvedere concretizes on
1, then the path becomes less
1, accentuates the way is well
0, from the waterfall but Gil
0, churches are very crowded
1, pass a first gateway +
0, wooden benches carried
1, follow the path to the right
0, bifurcation station of the two
0, encountered the ascent WP2 then
1, take the left lane across
0, crossing points km ALT
0, terrace at the campsite or for
0, wild animals of circuses
1, the small path that starts
1, on the track pass the
1, crossroads a broad grassy path
1, top of service building
0, the word Boulevard in its
1, right of the torrent until
1, tank level the track
0, m2 of wood and assembled
0, would not constitute a fracture
1, counts eleven Rome cemeteries of which
0, transport or slope
0, slope when
0, the tips of his collar
0, held at bifurcations and crossed
1, level one service Chalet
1, these two buildings were
1, on a narrow path and
1, the well-traced path is
0, specific balconies are sometimes
0, are home use huts
0, carriers of primitive suspended gateways
0, demolition a bar of 80
0, Paris the campsite hosts two
0, isolated points such as lookouts
1, left a street that goes down
0, crossing points km ALT
0, number of buildings offer it
0, run the name of Boulevard
0, end of the lake where part
0, old Alpine chalets existing
1, cross the stream to find
0, the splitting Bifurcations of
0, is the path back
1, in the parking lot located near
0, stoned with millimetre terminals placed
1, the large slopes that lead
1, then the road that passes
1, the road in a bend
1, from the hut and start
1, flank off path to reach
1, from the hut left
1, a panel traces this accident
0, make all possible collars
0, they were not accustomed to
1, on a regular slope on
0, circus dance humor and
1, walk along the cemetery and join
1, in front of the site climbing on
0, heart of tourist circuits Pons
1, the most
1, attention the weekly market is
0, road holes or paths
0, existence a negative circuit is
0, cascading style is saying
0, 26 arches of which 19
1, along the forest on 100m
0, this psychological barrier translates into
1, the path is well marked
1, this same path to pass
1, join the station pass by
0, only a few terminals call the
1, pass the left deck but
0, universal meaning parking is a
0, are pedestrian gateways and
1, follow the Cairns that depart
1, the last slope that is
1, from the parking lot enter the
1, from the station and pass
0, the J1 tags must cover
1, because the tray is very
1, leave a left path and
1, Chalet shelter visible from the crossroads
0, especially do not continue on
0, basin bottom the wash
0, times the road is never
1, regular on a stony path
1, top of the parking spot the
0, with a peak of 1000
1, left of the Lakes to pass
1, for semi-buried parking
0, oldest bamboo of France
0, the bar of 720 000
0, required travel time before
1, ignoring the road that leaves
1, new the path to the right
1, reach a crossroads + +
1, go to the parking lot of departure
1, take the trail flank of
0, whose upper terminal reaches
1, left the path climbs quietly
0, left field movement in
1, twelve major rectilinear avenues lead to
0, same path as the ascent
0, inclined and railroad
1, then the bifurcation marked the
0, the same circuits as the
0, deploys the control terminals
1, from the Lake return the hut
1, Olympic pools of playful and
1, South on the path grassy
1, continue the path above
1, direction of the artisanal zone
1, let a left path continue
0, priority at intersections with
1, in the uphill forest
1, then take the right road
0, replacing a bar or
1, by means of the
0, climb slopes up to 48
1, another path oriented to the
0, by express circuits with
0, crossing points km ALT
1, and continue on the way
1, by the castle to join
0, peak daily attendance
0, in chapels as in
0, number of arches seven to
1, a new crossroads of trails
0, climb slopes of 50
0, later by the peripheral Boulevard
0, not to follow too much
0, the gateways have a position
1, go back down on the road
1, parking a building to the South
0, finally the waterfall pushed by
0, however
1, two new passes to the
1, reach the parking lot and the
1, on the plateau not far
1, in the wood along
1, the same Cairns or by
1, take the bridge continue shore
0, altitude the Alpine chalets are
0, diverted from the official circuits of
1, on the trail marked on
1, reach a crossroads of trails crossroads
1, in the village and its bridge
0, or fountain Terminal in
0, progressing without a path in a
